{
  "id": "impulse_pullback_long",
  "name": "Impulse pullback long",
  "enabled": true,
  "type": "impulse_pullback_long",
  "timeframe": "1m",
  "params": {
    "lookback": 20,
    "minBodyRatio": 0.7,
    "minBodyMultiple": 2,
    "minVolumeMultiple": 2.5,
    "maxPullbackVolumeMultiple": 0.8,
    "minClosePositionInSignalRange": 0.5,
    "maxPullbackBars": 1,
    "rewardMultiple": 2.5,
    "limitExpiryBars": 15,
    "pointValue": 2,
    "quantity": 1
  }
}
